{
  "$schema": "https://json-schema.org/draft/2020-12/schema",
  "$id": "https://atlas-dataflow.local/schemas/publisher/release-candidate.schema.json",
  "title": "Atlas DataFlow Release Candidate",
  "description": "Internal publisher input model for an explicit release candidate package. A release candidate is assembled from pipeline-produced artifacts and submitted to the publisher for completeness validation before any promotion or registry update.",
  "type": "object",
  "additionalProperties": false,
  "required": [
    "schema_version",
    "candidate_kind",
    "dataset_identity",
    "release_identity",
    "source_run",
    "artifact_roles",
    "candidate_metadata",
    "state_boundaries"
  ],
  "properties": {
    "schema_version": {
      "type": "string",
      "const": "release-candidate.v1"
    },
    "candidate_kind": {
      "type": "string",
      "const": "release_candidate",
      "description": "Distinguishes this package from a transient pipeline run and from a promoted published release."
    },
    "dataset_identity": {
      "type": "object",
      "additionalProperties": false,
      "required": [
        "dataset_slug"
      ],
      "properties": {
        "dataset_slug": {
          "type": "string",
          "minLength": 1,
          "pattern": "^[a-z0-9]+(?:-[a-z0-9]+)*$",
          "description": "Stable dataset identifier used by registry and runtime resolution. It must be explicit and must not be inferred from a local path."
        },
        "dataset_title": {
          "type": "string",
          "minLength": 1
        }
      }
    },
    "release_identity": {
      "type": "object",
      "additionalProperties": false,
      "required": [
        "release_id",
        "release_version",
        "created_at"
      ],
      "properties": {
        "release_id": {
          "type": "string",
          "minLength": 1,
          "pattern": "^[a-z0-9]+(?:[-._][a-z0-9]+)*$",
          "description": "Stable candidate release identifier. It must be explicit and must not be inferred from a local path."
        },
        "release_version": {
          "type": "string",
          "minLength": 1,
          "description": "Version label for the candidate package before publisher promotion."
        },
        "created_at": {
          "type": "string",
          "format": "date-time"
        }
      }
    },
    "source_run": {
      "type": "object",
      "additionalProperties": false,
      "required": [
        "run_id",
        "producer"
      ],
      "properties": {
        "run_id": {
          "type": "string",
          "minLength": 1,
          "description": "Identifier for the pipeline or manual assembly run that produced candidate artifacts. This does not make the run publishable by itself."
        },
        "producer": {
          "type": "string",
          "minLength": 1
        },
        "created_at": {
          "type": "string",
          "format": "date-time"
        }
      }
    },
    "artifact_roles": {
      "type": "object",
      "additionalProperties": false,
      "required": [
        "contracts",
        "public_contract",
        "predictive_bundle",
        "model_artifact",
        "metrics",
        "model_card",
        "public_context",
        "visualizations",
        "manifest_input",
        "candidate_metadata"
      ],
      "description": "Project Spec S0193: visualizations is a mandatory role for every candidate, historical/internal or validated external fitted-model alike -- the Project Spec S0188 structural relaxation that had permitted a validated external fitted-model candidate to omit it has been removed.",
      "properties": {
        "contracts": {
          "$ref": "#/$defs/artifact_role",
          "description": "Runtime contract artifact required by the publisher and internal validation. Distinct from the public_contract role below."
        },
        "public_contract": {
          "$ref": "#/$defs/artifact_role",
          "description": "Public-facing contract projection artifact, candidate-relative and distinct from the runtime 'contracts' role. Consumed by the public API's contract endpoint after promotion."
        },
        "predictive_bundle": {
          "$ref": "#/$defs/artifact_role",
          "description": "Inference bundle produced by the artifact pipeline and consumed only after publication."
        },
        "model_artifact": {
          "$ref": "#/$defs/artifact_role",
          "description": "Release-bound governed model artifact (binary), distinct from predictive_bundle (a JSON descriptor), model_card (public documentation), and training evidence."
        },
        "metrics": {
          "$ref": "#/$defs/artifact_role",
          "description": "Model or dataset metrics required for traceability and public context."
        },
        "model_card": {
          "$ref": "#/$defs/artifact_role",
          "description": "Model card or equivalent model documentation artifact."
        },
        "public_context": {
          "$ref": "#/$defs/artifact_role",
          "description": "Public dataset context intended for the published experience."
        },
        "visualizations": {
          "$ref": "#/$defs/artifact_role",
          "description": "Release-bound, deterministic analytical visualizations artifact (Target Distribution and Feature Importance), produced during governed training (Project Spec S0128)."
        },
        "manifest_input": {
          "$ref": "#/$defs/artifact_role",
          "description": "Input used by the publisher to generate or validate the final release manifest."
        },
        "candidate_metadata": {
          "$ref": "#/$defs/artifact_role",
          "description": "Structured metadata describing the candidate package itself."
        }
      }
    },
    "candidate_metadata": {
      "type": "object",
      "additionalProperties": false,
      "required": [
        "assembled_by",
        "assembled_at",
        "intended_publisher_action",
        "completeness_validation"
      ],
      "properties": {
        "assembled_by": {
          "type": "string",
          "minLength": 1
        },
        "assembled_at": {
          "type": "string",
          "format": "date-time"
        },
        "intended_publisher_action": {
          "type": "string",
          "const": "validate_candidate"
        },
        "completeness_validation": {
          "type": "object",
          "additionalProperties": false,
          "required": [
            "required_artifact_roles",
            "hash_policy",
            "manifest_policy"
          ],
          "properties": {
            "required_artifact_roles": {
              "type": "array",
              "minItems": 10,
              "maxItems": 10,
              "uniqueItems": true,
              "items": {
                "type": "string",
                "enum": [
                  "contracts",
                  "public_contract",
                  "predictive_bundle",
                  "model_artifact",
                  "metrics",
                  "model_card",
                  "public_context",
                  "visualizations",
                  "manifest_input",
                  "candidate_metadata"
                ]
              },
              "description": "Project Spec S0193: exactly 10 roles (including visualizations) for every candidate, historical/internal or validated external fitted-model alike. Every role is mandatory.",
              "allOf": [
                { "contains": { "const": "contracts" } },
                { "contains": { "const": "public_contract" } },
                { "contains": { "const": "predictive_bundle" } },
                { "contains": { "const": "model_artifact" } },
                { "contains": { "const": "metrics" } },
                { "contains": { "const": "model_card" } },
                { "contains": { "const": "public_context" } },
                { "contains": { "const": "visualizations" } },
                { "contains": { "const": "manifest_input" } },
                { "contains": { "const": "candidate_metadata" } }
              ]
            },
            "hash_policy": {
              "type": "string",
              "enum": [
                "publisher_calculates_hashes",
                "publisher_verifies_declared_hashes"
              ]
            },
            "manifest_policy": {
              "type": "string",
              "enum": [
                "publisher_generates_manifest",
                "publisher_validates_manifest_input"
              ]
            }
          }
        },
        "notes": {
          "type": "array",
          "items": {
            "type": "string",
            "minLength": 1
          }
        }
      }
    },
    "model_delivery": {"$ref": "#/$defs/model_delivery_metadata"},
    "capability_binding": {
      "type": "object",
      "additionalProperties": false,
      "required": [
        "dataset_slug",
        "authoring_generation_id",
        "authoring_manifest_ref",
        "capability_profile_id",
        "capability_profile_version",
        "capability_profile_ref",
        "resolved_role_policy"
      ],
      "description": "Project Spec S0168. Optional capability-aware identity for this release candidate, additive only (new optional property; existing required array unchanged). Absent for a candidate governed by the historical fixed artifact_roles shape above, which remains valid. Never duplicates the full capability profile or authoring manifest payload -- only governed (path + sha256) references and a resolved role policy. Applicability must be resolved from the referenced capability profile, never inferred from dataset identity, filesystem existence, or a milestone id.",
      "properties": {
        "dataset_slug": {
          "$ref": "#/$defs/dataset_slug",
          "description": "Must match dataset_identity.dataset_slug."
        },
        "authoring_generation_id": {"$ref": "#/$defs/identifier"},
        "authoring_manifest_ref": {
          "allOf": [
            {"$ref": "#/$defs/governed_reference"},
            {
              "properties": {
                "contract_version": {
                  "type": "string",
                  "const": "dataset-integration-authoring-manifest.v1"
                }
              }
            }
          ]
        },
        "capability_profile_id": {"$ref": "#/$defs/capability_identifier"},
        "capability_profile_version": {
          "type": "string",
          "minLength": 1,
          "pattern": "^v[0-9]+$"
        },
        "capability_profile_ref": {"$ref": "#/$defs/governed_reference"},
        "resolved_role_policy": {
          "type": "array",
          "minItems": 1,
          "items": {"$ref": "#/$defs/role_policy_entry"}
        }
      }
    },
    "state_boundaries": {
      "type": "object",
      "additionalProperties": false,
      "required": [
        "pipeline_run_is_publishable",
        "candidate_is_published_release",
        "promotion_required",
        "registry_update_allowed_in_candidate",
        "public_upload_required",
        "web_administration_required",
        "database_publication_management_required",
        "runtime_consumes_temporary_pipeline_output"
      ],
      "properties": {
        "pipeline_run_is_publishable": {
          "type": "boolean",
          "const": false
        },
        "candidate_is_published_release": {
          "type": "boolean",
          "const": false
        },
        "promotion_required": {
          "type": "boolean",
          "const": true
        },
        "registry_update_allowed_in_candidate": {
          "type": "boolean",
          "const": false
        },
        "public_upload_required": {
          "type": "boolean",
          "const": false
        },
        "web_administration_required": {
          "type": "boolean",
          "const": false
        },
        "database_publication_management_required": {
          "type": "boolean",
          "const": false
        },
        "runtime_consumes_temporary_pipeline_output": {
          "type": "boolean",
          "const": false
        }
      }
    }
  },
  "$defs": {
    "model_delivery_metadata": {
      "type": "object", "additionalProperties": false,
      "required": ["role", "artifact_id", "artifact_format", "loader_family", "path", "sha256", "inference_bundle_id", "provenance"],
      "properties": {
        "role": {"type": "string", "const": "model_artifact"}, "artifact_id": {"$ref": "#/$defs/identifier"},
        "artifact_format": {"type": "string", "minLength": 1}, "loader_family": {"type": "string", "minLength": 1},
        "path": {"$ref": "#/$defs/safe_relative_governed_path"}, "sha256": {"$ref": "#/$defs/sha256_hex"},
        "inference_bundle_id": {"$ref": "#/$defs/identifier"},
        "provenance": {"type": "object", "additionalProperties": false, "required": ["source_reference"], "properties": {"source_reference": {"type": "string", "minLength": 1}, "source_revision": {"type": "string", "minLength": 1}}}
      }
    },
    "dataset_slug": {
      "type": "string",
      "minLength": 1,
      "pattern": "^[a-z0-9]+(?:-[a-z0-9]+)*$"
    },
    "identifier": {
      "type": "string",
      "minLength": 1,
      "pattern": "^[a-z0-9]+(?:[-._][a-z0-9]+)*$"
    },
    "capability_identifier": {
      "type": "string",
      "minLength": 1,
      "pattern": "^[a-z0-9]+(?:[-_][a-z0-9]+)*$"
    },
    "role_applicability": {
      "type": "string",
      "enum": ["required", "optional", "forbidden"]
    },
    "sha256_hex": {
      "type": "string",
      "pattern": "^[a-f0-9]{64}$"
    },
    "safe_relative_governed_path": {
      "type": "string",
      "minLength": 1,
      "pattern": "^(?!/)(?!.*(?:^|/)\\.\\.(?:/|$))(?!.*//)(?!.*\\\\)(?![A-Za-z]:)[A-Za-z0-9][A-Za-z0-9._/-]*[^/]$",
      "description": "Repository-relative governed reference path. Absolute paths, parent traversal, repeated separators, and Windows paths are invalid."
    },
    "governed_reference": {
      "type": "object",
      "additionalProperties": false,
      "required": ["path", "sha256"],
      "properties": {
        "path": {"$ref": "#/$defs/safe_relative_governed_path"},
        "sha256": {"$ref": "#/$defs/sha256_hex"}
      }
    },
    "role_policy_entry": {
      "type": "object",
      "additionalProperties": false,
      "required": ["role_name", "applicability", "present"],
      "description": "One artifact role's resolved applicability under a capability profile, and whether it is present in this release candidate. A forbidden role must never be present; a required role must be present.",
      "properties": {
        "role_name": {
          "type": "string",
          "minLength": 1,
          "pattern": "^[a-z][a-z0-9_]*$"
        },
        "applicability": {"$ref": "#/$defs/role_applicability"},
        "present": {"type": "boolean"}
      },
      "allOf": [
        {
          "if": {
            "properties": {"applicability": {"const": "forbidden"}},
            "required": ["applicability"]
          },
          "then": {"properties": {"present": {"const": false}}}
        },
        {
          "if": {
            "properties": {"applicability": {"const": "required"}},
            "required": ["applicability"]
          },
          "then": {"properties": {"present": {"const": true}}}
        }
      ]
    },
    "artifact_role": {
      "type": "object",
      "additionalProperties": false,
      "required": [
        "role",
        "path",
        "required"
      ],
      "properties": {
        "role": {
          "type": "string",
          "minLength": 1
        },
        "path": {
          "type": "string",
          "minLength": 1,
          "description": "Candidate package-relative artifact path or URI. This path locates an artifact; it is not the public source of truth for dataset or release identity."
        },
        "required": {
          "type": "boolean",
          "const": true
        },
        "media_type": {
          "type": "string",
          "minLength": 1
        },
        "sha256": {
          "type": "string",
          "pattern": "^[a-f0-9]{64}$",
          "description": "Optional declared hash. The publisher may calculate or verify hashes during validation."
        }
      }
    }
  }
}
